{ 	
	"id": "urn:entity:busan:transport:bus:busId:<busLineId>",
	"refBusStops":["urn:entity:busan:transport:bus:busStop:<busStopId>"],
	"localID":"104",
	"shortID":"5200104000",
	"name": "PENACASTILLO â€“ PLAZA DE ITALIA",
	"refStartBusStop":"urn:entity:busan:transport:bus:busStop:<busStopId>",
	"refEndBusStop":"urn:entity:busan:transport:bus:busStop:<busStopId>",
	"busLineType":"standard",
	"startTime":"2017-02-05T08:15:30-05:09",
	"endTime":"2017-02-05T08:15:30-05:09",
	"intervalNorm":"P3Y6M4DT12H30M5S",
	"intervalHoli":"P3Y6M4DT12H30M5S",
	"intervalPeak":"P3Y6M4DT12H30M5S",
	"dateModified":"2017-02-05T08:15:30-05:09"
}